"SchoolName","Address","Pincode","ContactEmail","ContactPhone","Website","GMapLink","PlaceID"
"Sankardev Shishu Niketan, Latibari","JMX4+5XM, Pubkachukata, Assam 781364, India","781364","NA","NA","NA","https://maps.google.com/?cid=14340506101065029318","ChIJG_p8sza7WzcRxpZN1VG2A8c"
"Shankardev Vidya Niketan Tamulpur","JH4H+QXV, Barkhopa, Assam 781367, India","781367","NA","NA","NA","https://maps.google.com/?cid=4227047971527458066","ChIJ-XITaee5WzcREv1t97t9qTo"
"Amar jyoti Jatiya Vidyalaya","GGMR+M7W, Tamulpur-Ghograpar Rd, Pub-Barsiral, Dalbari Kaniha, Assam 781369, India","781369","NA","NA","NA","https://maps.google.com/?cid=11169843229438096116","ChIJV53Kw823WzcR9LJ1nzxBA5s"
"Sankardev Shishu Niketan, Latibari","JMX4+5XM, Pubkachukata, Assam 781364, India","781364","NA","NA","NA","https://maps.google.com/?cid=14340506101065029318","ChIJG_p8sza7WzcRxpZN1VG2A8c"
"Dr. Ambedkar High School, Joypur","Joypur, PMR7+CH8, Nagrijuli, Barnadi Par, No.2.Dongargaon, Assam 781368, India","781368","NA","NA","NA","https://maps.google.com/?cid=3563490728304391939","ChIJ6ZXinSe9WzcRAzf77O8PdDE"
"Bishnu Jyoti Jatiya vidyalaya School","JH5F+M55, Barkhopa, Assam 781367, India","781367","NA","NA","NA","https://maps.google.com/?cid=14903765555822361497","ChIJuZtcbdu5WzcRmXt-Os_P1M4"
"Rupkonwar jatiya vidyalaya","Tamulpur - Nagrijuli - Guwabari Rd, Barimakha, Assam 781368, India","781368","NA","NA","NA","https://maps.google.com/?cid=818284870224542286","ChIJC916kV27WzcRTnrPBsEhWws"
"Adarsha Vidya Niketan kachubari","JJG3+G39, Barbilbari, Assam 781367, India","781367","NA","NA","NA","https://maps.google.com/?cid=17845456804014202703","ChIJbyxCeiG6WzcRTx_Y-WnMp_c"
"Shankardev Sishu Vidya Niketan","PHQ3+34Q, Kumarikata, Assam 781360, India","781360","NA","NA","NA","https://maps.google.com/?cid=11742475246951714849","ChIJuxUf-wa_WzcRIdBf1gWn9aI"
"Upendra National Academy, Kumarikata","PHJ5+HCF, Kumarikata, Assam 781360, India","781360","NA","073992 29400","NA","https://maps.google.com/?cid=13327181357688868882","ChIJJWPxkAK_WzcREtBAmtWo87g"
"Educare Institute","Darranga Road, QGM4+HPG, Town Sashipur, PO Darrangamela, PS Tamulpur, N.K Darranga, N.C.Angarkata, Assam 781360, India","781360","NA","098966 57189","NA","https://maps.google.com/?cid=7503852075892230212","ChIJeQWiGRzAWzcRREiitrQJI2g"
"Adarsha Bidya Niketan, Guwabari","QMHG+5CM, Deochunga, Assam 781368, India","781368","NA","NA","NA","https://maps.google.com/?cid=9252706779459161742","ChIJL9Pp4YO9WzcRjg6DAMs3aIA"
"Adarsha Bidya Niketan, Guwabari","QMHG+5CM, Deochunga, Assam 781368, India","781368","NA","NA","NA","https://maps.google.com/?cid=9252706779459161742","ChIJL9Pp4YO9WzcRjg6DAMs3aIA"
"Shankardev Academy Jatiya Bidyalaya Nagrijuli","Batipar, Tamulpur, Khatorbari, Assam 781368, India","781368","NA","080113 75054","NA","https://maps.google.com/?cid=16790495430210819924","ChIJTSyBKZK8WzcRVBeJSKLSA-k"
"Adarsha Jatiya Vidyalaya Kawli","Chandanpur, Kawli, QJ67+934, Chandanpur, Assam 781360, India","781360","NA","NA","NA","https://maps.google.com/?cid=657666712116103295","ChIJQRXNSLW9WzcRf4hH5GOAIAk"
"Sankardev Shishu Niketan, Latibari","JMX4+5XM, Pubkachukata, Assam 781364, India","781364","NA","NA","NA","https://maps.google.com/?cid=14340506101065029318","ChIJG_p8sza7WzcRxpZN1VG2A8c"
"Grace English School","No2 paharpur.(kanchi bazar, No.2.Bagurikhuti, Assam 781368, India","781368","NA","NA","NA","https://maps.google.com/?cid=3047991592651927595","ChIJXUJDld6XWzcRKzBlXjSkTCo"
"U.N. ACADEMY,TAMULPUR","JH2Q+X5C, Gerua, Assam 781367, India","781367","NA","NA","NA","https://maps.google.com/?cid=18372533450194224465","ChIJ4QhXJuO5WzcRUQXPwtRZ-P4"
"Shankardev Vidya Niketan Tamulpur","JH4H+QXV, Barkhopa, Assam 781367, India","781367","NA","NA","NA","https://maps.google.com/?cid=4227047971527458066","ChIJ-XITaee5WzcREv1t97t9qTo"
"Ambikagiri Jatiya Bidyalaya Kumarikata","PHR2+XFG, Kumarikata, Bahbari, Assam 781360, India","781360","NA","NA","NA","https://maps.google.com/?cid=2856216531790178293","ChIJIcSiv0a_WzcR9afzgs1Royc"
"Pragya jyoti jatiyo Bidyaloy","MJ34+7QP, Tamulpur - Nagrijuli - Guwabari Rd, Ramechubari, Kachubari, Assam 781368, India","781368","NA","NA","NA","https://maps.google.com/?cid=1011828955954177250","ChIJr6pYLoy7WzcR4mQaFRO9Cg4"
"Dantak Public School","QGR2+VV3, Baksa, Assam 781360, India","781360","NA","NA","NA","https://maps.google.com/?cid=6596377794799711752","ChIJsw3aLKDqWzcRCLZPv6cKi1s"
"Adarsha Vidyalaya, Tamulpur","PHJ7+GR9, Tamulpur - Darranga Rd, Kumarikata, Batiamari No.1, Assam 781360, India","781360","NA","NA","https://avtamulpur.in/","https://maps.google.com/?cid=12448244877455107934","ChIJefGvfC2_WzcRXqfJLcMMwaw"
"Bathou Ashram High School Adalbari","Adalbari, Baksa, SH-10A, Kadamtal Nikasi Road, Muchalpur, Muchalpur, Adalbari, Assam 781372, India","781372","NA","NA","NA","https://maps.google.com/?cid=5109174548731498533","ChIJKQ775ZzaWzcRJZCbuC5v50Y"
"Tamulpur Higher Secondary School","JH4H+GQ4 Tangla-Tamulpur Road, Bareigaon Rd, Barkhopa, Assam 781367, India","781367","NA","094353 11002","NA","https://maps.google.com/?cid=1895958790109842359","ChIJ1XdaWOe5WzcRt8tGcXnMTxo"
"PHUNGBILI SWLWNGCHALI","GHMW+QFF, Khudra Gar Kona, Assam 781368, India","781368","NA","NA","NA","https://maps.google.com/?cid=1955462639885532774","ChIJvQx1rlq3WzcRZr7sFekyIxs"
"Shankardev Vidya Niketan Tamulpur","JH4H+QXV, Barkhopa, Assam 781367, India","781367","NA","NA","NA","https://maps.google.com/?cid=4227047971527458066","ChIJ-XITaee5WzcREv1t97t9qTo"
"Adarsha Vidyalaya, Tamulpur","PHJ7+GR9, Tamulpur - Darranga Rd, Kumarikata, Batiamari No.1, Assam 781360, India","781360","NA","NA","https://avtamulpur.in/","https://maps.google.com/?cid=12448244877455107934","ChIJefGvfC2_WzcRXqfJLcMMwaw"
"Ankuran Sishu Niketan,Goreswar","GPPG+56R, Goreswar-Naokata Rd, No.3 Goreswar, Assam 781366, India","781366","NA","NA","https://schools.org.in/","https://maps.google.com/?cid=14197602272756339752","ChIJxS33M-6uWzcRKJTrgQsECMU"
"Rainbow English School","GPJH+65H, No.5 Goreswar, Assam 781366, India","781366","NA","NA","NA","https://maps.google.com/?cid=3266533684989681998","ChIJz3i8W-yuWzcRTmGoZBQPVS0"
"Sankar Ajan Jatiya Vidyalaya","Rangia latibari roadnear baksa dist markaz masjid khandikar khandikar, Fourabari, Assam 781354, India","781354","NA","080114 28107","NA","https://maps.google.com/?cid=3236061375439028592","ChIJaUZ7nFGyWzcRcMFn8qzM6Cw"
"Sankar Ajan Jatiya Vidyalaya ,Kaurbaha","GJCW+2Q7, Kaurbaha Bazar, Hatimura, Assam 781364, India","781364","NA","NA","NA","https://maps.google.com/?cid=18330081294613838441","ChIJ-ZRUnJCxWzcRaXp9DdKHYf4"
"Borghuli Jatiya Bidyalaya","GJPV+MQX, Borghuli, Assam 781364, India","781364","NA","NA","NA","https://maps.google.com/?cid=2133114427181599062","ChIJq6qqqqWxWzcRVolrEUVYmh0"
"Akalabya Bidyamandir,Maharipara.","HPVG+RVQ, Ramsajar, Assam 781364, India","781364","NA","NA","NA","https://maps.google.com/?cid=3473905181053895396","ChIJUXp8qmOvWzcR5EIbTFvKNTA"
"Adarsha jatiya vidyalaya gashbari school","FPPH+Q68, SH 11, Gorka, Assam 781366, India","781366","NA","NA","NA","https://maps.google.com/?cid=2585189018975265891","ChIJpfKLgSKtWzcRY-RCQbdv4CM"
"Sankardev Shishu Niketan, Latibari","JMX4+5XM, Pubkachukata, Assam 781364, India","781364","NA","NA","NA","https://maps.google.com/?cid=14340506101065029318","ChIJG_p8sza7WzcRxpZN1VG2A8c"
"Adarsha Vidyalaya, Tamulpur","PHJ7+GR9, Tamulpur - Darranga Rd, Kumarikata, Batiamari No.1, Assam 781360, India","781360","NA","NA","https://avtamulpur.in/","https://maps.google.com/?cid=12448244877455107934","ChIJefGvfC2_WzcRXqfJLcMMwaw"
"Sunrise Jr College","JRHC+3GX, Dewa Guri, Assam 784522, India","784522","NA","NA","NA","https://maps.google.com/?cid=14545479197637049422","ChIJ0b9C-IanWzcRTnz91kPs28k"
"Pride Academy Jr College & School","HX9J+2G3, No.2 Kalaigaon, Kalaigaon, Assam 784525, India","784525","NA","NA","NA","https://maps.google.com/?cid=2719025510986204949","ChIJu57bUTYFWzcRFceO1UvruyU"